{
  "schema_version": 1,
  "diagram_type": "architecture",
  "meta": {
    "title": "sync-zendesk — Conflito de E-mails",
    "output": "architecture.html",
    "quality_profile": "showcase",
    "repository": {
      "url": "git@gitlab.com:onflylabs/general/microservicos/travel-ms/sync-zendesk.git",
      "link_mode": "local-only",
      "revision": "2df526033d6b4d1b75b941cdd159daab570652f6"
    },
    "views": [
      {
        "id": "main-path",
        "label": "Fluxo principal",
        "focus": [
          "cron",
          "cmd",
          "synclog",
          "zsrv",
          "zapi"
        ],
        "note": "Comando carrega falhas do sync log, busca os cadastros no Zendesk por external_id e e-mail e aplica o caso A/B/C/D."
      },
      {
        "id": "cases",
        "label": "Casos A · B · C · D",
        "focus": [
          "cmd",
          "zsrv",
          "zapi"
        ],
        "note": "A=merge com guarda; B=sync no próprio cadastro; C=linka external_id; D=revisão manual."
      },
      {
        "id": "higiene",
        "label": "Higienização de identidades",
        "focus": [
          "cmd",
          "zsrv",
          "bqsrv",
          "bq"
        ],
        "note": "Em todo sucesso, identidades extras de e-mail são removidas e o dono real é re-sincronizado via BigQuery."
      },
      {
        "id": "rate-limit",
        "label": "Rate limit e retry",
        "focus": [
          "zsrv",
          "zapi"
        ],
        "note": "Mesmo ZendeskService: throttle de 600ms, retry ×3 com backoff e Retry-After no 429."
      }
    ],
    "locale": "pt-BR",
    "viewBox": [
      1170,
      540
    ]
  },
  "components": [
    {
      "id": "cron",
      "type": "external",
      "label": "Operador / Cron",
      "sublabel": "sync-conflicting-user-emails",
      "pos": [
        40,
        220
      ],
      "size": [
        150,
        64
      ]
    },
    {
      "id": "cmd",
      "type": "backend",
      "label": "SyncConflictingEmailCmd",
      "sublabel": "casos A · B · C · D",
      "tag": "--dry-run · --report",
      "sources": [
        {
          "path": "app/Command/Sync/ZendeskSyncConflictingUserEmailCommand.php",
          "label": "handle · casos"
        }
      ],
      "pos": [
        315,
        220
      ],
      "size": [
        210,
        64
      ]
    },
    {
      "id": "zsrv",
      "type": "backend",
      "label": "ZendeskService",
      "sublabel": "find · merge · identities",
      "tag": "throttle 600ms",
      "sources": [
        {
          "path": "app/Service/Zendesk/ZendeskService.php",
          "label": "getUserBy · mergeUser"
        }
      ],
      "pos": [
        665,
        220
      ],
      "size": [
        190,
        64
      ]
    },
    {
      "id": "zapi",
      "type": "external",
      "label": "Zendesk REST API",
      "sublabel": "search · merge · identities",
      "pos": [
        920,
        220
      ],
      "size": [
        175,
        64
      ]
    },
    {
      "id": "bqsrv",
      "type": "backend",
      "label": "BigQueryClientService",
      "sublabel": "streamQuery() · payload",
      "pos": [
        600,
        60
      ],
      "size": [
        180,
        64
      ]
    },
    {
      "id": "bq",
      "type": "cloud",
      "label": "BigQuery",
      "sublabel": "temp_to_zenddesk_users",
      "tag": "dono do e-mail",
      "pos": [
        830,
        60
      ],
      "size": [
        150,
        64
      ]
    },
    {
      "id": "mapper",
      "type": "backend",
      "label": "Mapping Layer",
      "sublabel": "RowMapper · ZendeskMapper",
      "tag": "→ ZendeskUserDTO",
      "sources": [
        {
          "path": "app/Mapping/ZendeskMapper.php",
          "label": "toUser()"
        },
        {
          "path": "app/Mapping/BigQueryRowMapper.php",
          "label": "mapUserRow()"
        }
      ],
      "pos": [
        340,
        60
      ],
      "size": [
        170,
        64
      ]
    },
    {
      "id": "synclog",
      "type": "database",
      "label": "MySQL sync log",
      "sublabel": "zendesk_users_sync_log",
      "tag": "falhas UserUpdateError",
      "sources": [
        {
          "path": "app/Model/ZendeskUserSyncLog.php",
          "label": "status · last_error"
        }
      ],
      "pos": [
        315,
        400
      ],
      "size": [
        210,
        64
      ]
    },
    {
      "id": "report",
      "type": "backend",
      "label": "Relatório .md",
      "sublabel": "runtime/reports/",
      "tag": "--report",
      "pos": [
        720,
        400
      ],
      "size": [
        180,
        64
      ]
    }
  ],
  "boundaries": [
    {
      "kind": "region",
      "label": "sync-zendesk (Hyperf 3.1 · Swoole 6.1)",
      "wraps": [
        "cmd",
        "zsrv",
        "bqsrv",
        "mapper"
      ]
    }
  ],
  "connections": [
    {
      "id": "run",
      "from": "cron",
      "to": "cmd",
      "variant": "emphasis"
    },
    {
      "id": "fetch",
      "from": "synclog",
      "to": "cmd",
      "label": "falhas por e-mail",
      "fromSide": "top",
      "toSide": "bottom",
      "labelDx": -160
    },
    {
      "id": "lookup",
      "from": "cmd",
      "to": "zsrv",
      "label": "casos A·B·C",
      "labelDy": -16
    },
    {
      "id": "api",
      "from": "zsrv",
      "to": "zapi",
      "label": "merge · update · identities",
      "labelDy": -40
    },
    {
      "id": "state",
      "from": "zsrv",
      "to": "synclog",
      "label": "updateUserLocalMapping",
      "fromSide": "bottom",
      "toSide": "top",
      "via": [
        [
          805,
          340
        ],
        [
          520,
          340
        ]
      ],
      "labelAt": [
        660,
        328
      ]
    },
    {
      "id": "bqfetch",
      "from": "cmd",
      "to": "bqsrv",
      "label": "payload + donos de e-mail",
      "fromSide": "top",
      "toSide": "bottom",
      "via": [
        [
          420,
          190
        ],
        [
          690,
          190
        ],
        [
          690,
          124
        ]
      ],
      "labelAt": [
        555,
        178
      ]
    },
    {
      "id": "bqreq",
      "from": "bqsrv",
      "to": "bq",
      "label": "SQL"
    },
    {
      "id": "map",
      "from": "zsrv",
      "to": "mapper",
      "label": "resolveZendeskUserId()",
      "fromSide": "top",
      "toSide": "right",
      "via": [
        [
          760,
          160
        ],
        [
          560,
          160
        ],
        [
          560,
          92
        ],
        [
          510,
          92
        ]
      ],
      "labelAt": [
        635,
        148
      ]
    },
    {
      "id": "report-edge",
      "from": "cmd",
      "to": "report",
      "label": "agrupa por caso",
      "fromSide": "bottom",
      "toSide": "top",
      "via": [
        [
          480,
          284
        ],
        [
          480,
          365
        ],
        [
          810,
          365
        ],
        [
          810,
          400
        ]
      ],
      "labelAt": [
        645,
        378
      ]
    }
  ],
  "cards": [
    {
      "dot": "cyan",
      "title": "Casos de conflito",
      "items": [
        "Fonte: zendesk_users_sync_log (status=failure, zendesk_user_id IS NULL, error_message \"Email: %\")",
        "A: e-mail em outro cadastro → mergeUser(e-mail → external_id) com guarda de segurança",
        "A.REALOCADO: fonte tem external_id real próprio → merge bloqueado; sync direto no alvo, sem merge",
        "B: só external_id → b.1 e-mail correto (sync dos dados) / b.2 desatualizado (atualiza e-mail + dados); sem merge",
        "C: só e-mail → linka external_id + sync; D: nada encontrado → revisão manual"
      ]
    },
    {
      "dot": "violet",
      "title": "Higienização de identidades",
      "items": [
        "Em todo sucesso (A, B, C): getUserIdentities() lista todas as identidades de e-mail do cadastro",
        "Identidade ≠ e-mail Onfly pertencente a outro usuário ativo (BigQuery) → deleteUserIdentity()",
        "Dono real re-sincronizado como cadastro novo via resolveZendeskUserId()",
        "Falha no re-sync → sync log do OUTRO external_id com last_error = UserCreatedError (pendente)"
      ]
    },
    {
      "dot": "amber",
      "title": "Rate limit (Zendesk)",
      "items": [
        "throttleRequest(): mínimo 600ms entre requisições (~100 req/min)",
        "requestWithRetry(): MAX_ATTEMPTS=3; Connect/Server → backoff 2^n (1/2/4s)",
        "429 → Retry-After; esgotado → TransientZendeskException; outros 4xx → PermanentValidationException",
        "pollJobStatus(): backoff 2/5/10/30s, timeout 300s; failed/killed → TransientZendeskException",
        "esperas via Coroutine::sleep() — não bloqueiam worker Swoole"
      ]
    }
  ]
}